type,subType,author,addressee,title,"editorList
",titleVolume,journal,partANDvol,place,"publisher
",date,pages,link
Fonte,Letteraria,Pier Paolo Vergerio il giovane,Ordine dei frati predicatori,"A quegli venerabili padri Domenicani, che difendono il Rosario per cosa buona.",,,,,s.d. ,s.t. ,1550,,http://dx.doi.org/10.3931/e-rara-19337
Fonte,Letteraria,Alberto da Cestello,,Rosario della gloriosa Vergine Maria,,,,,Venezia,Melchiorre Sessa & Pietro Ravani,1522,,https://archive.org/details/rosariodellaglor00cast
Bibliografia,Capitolo di libro,Silvano Cavazza,,Quei che vogliono Cristo senza croce”: Vergerio e i prelati riformatori italiani (1549-1555),Ugo Rozzo,"Pier Paolo Vergerio il giovane, un polemista attraverso l'Europa del Cinquecento",,,Udine,Forum,2000,107-142,
